{
  "$schema": "../schemas/catalog.schema.json",
  "schema_version": "1.0",
  "verified_on": "2026-10-15",
  "authority_order": [
    "1-official-exam",
    "2-official-learning",
    "3-curated-community",
    "4-unverified-auxiliary"
  ],
  "resources": [
    {
      "id": "official-guide",
      "name": "AZ-900 English study guide",
      "url": "https://learn.microsoft.com/en-us/credentials/certifications/resources/study-guides/az-900",
      "author": "Microsoft",
      "type": "exam-guide",
      "language": "en",
      "cost": "free",
      "domains": [
        "D1",
        "D2",
        "D3"
      ],
      "competencies": [
        "AZ900-1.1.1",
        "AZ900-1.1.2",
        "AZ900-1.1.3",
        "AZ900-1.1.4",
        "AZ900-1.1.5",
        "AZ900-1.1.6",
        "AZ900-1.1.7",
        "AZ900-1.2.1",
        "AZ900-1.2.2",
        "AZ900-1.2.3",
        "AZ900-1.2.4",
        "AZ900-1.3.1",
        "AZ900-1.3.2",
        "AZ900-1.3.3",
        "AZ900-1.3.4",
        "AZ900-2.1.1",
        "AZ900-2.1.2",
        "AZ900-2.1.3",
        "AZ900-2.1.4",
        "AZ900-2.1.5",
        "AZ900-2.1.6",
        "AZ900-2.1.7",
        "AZ900-2.2.1",
        "AZ900-2.2.2",
        "AZ900-2.2.3",
        "AZ900-2.2.4",
        "AZ900-2.2.5",
        "AZ900-2.2.6",
        "AZ900-2.3.1",
        "AZ900-2.3.2",
        "AZ900-2.3.3",
        "AZ900-2.3.4",
        "AZ900-2.3.5",
        "AZ900-2.3.6",
        "AZ900-2.4.1",
        "AZ900-2.4.2",
        "AZ900-2.4.3",
        "AZ900-2.4.4",
        "AZ900-2.4.5",
        "AZ900-2.4.6",
        "AZ900-2.4.7",
        "AZ900-2.4.8",
        "AZ900-3.1.1",
        "AZ900-3.1.2",
        "AZ900-3.1.3",
        "AZ900-3.1.4",
        "AZ900-3.2.1",
        "AZ900-3.2.2",
        "AZ900-3.2.3",
        "AZ900-3.3.1",
        "AZ900-3.3.2",
        "AZ900-3.3.3",
        "AZ900-3.3.4",
        "AZ900-3.3.5",
        "AZ900-3.4.1",
        "AZ900-3.4.2",
        "AZ900-3.4.3"
      ],
      "published_on": "2026-06-22",
      "last_verified": "2026-10-15",
      "verification": "landing-page-content-reviewed",
      "authority": "1-official-exam",
      "editorial_notes": "Source of scope, weights and effective version. Follow before any other curriculum source.",
      "limitations": "Representative skills, not a guarantee of question coverage. English updates precede localized exams."
    },
    {
      "id": "certification",
      "name": "Azure Fundamentals certification overview",
      "url": "https://learn.microsoft.com/en-us/credentials/certifications/azure-fundamentals/",
      "author": "Microsoft",
      "type": "certification-page",
      "language": "en",
      "cost": "free",
      "domains": [
        "D1",
        "D2",
        "D3"
      ],
      "competencies": [
        "AZ900-1.1.1",
        "AZ900-1.1.2",
        "AZ900-1.1.3",
        "AZ900-1.1.4",
        "AZ900-1.1.5",
        "AZ900-1.1.6",
        "AZ900-1.1.7",
        "AZ900-1.2.1",
        "AZ900-1.2.2",
        "AZ900-1.2.3",
        "AZ900-1.2.4",
        "AZ900-1.3.1",
        "AZ900-1.3.2",
        "AZ900-1.3.3",
        "AZ900-1.3.4",
        "AZ900-2.1.1",
        "AZ900-2.1.2",
        "AZ900-2.1.3",
        "AZ900-2.1.4",
        "AZ900-2.1.5",
        "AZ900-2.1.6",
        "AZ900-2.1.7",
        "AZ900-2.2.1",
        "AZ900-2.2.2",
        "AZ900-2.2.3",
        "AZ900-2.2.4",
        "AZ900-2.2.5",
        "AZ900-2.2.6",
        "AZ900-2.3.1",
        "AZ900-2.3.2",
        "AZ900-2.3.3",
        "AZ900-2.3.4",
        "AZ900-2.3.5",
        "AZ900-2.3.6",
        "AZ900-2.4.1",
        "AZ900-2.4.2",
        "AZ900-2.4.3",
        "AZ900-2.4.4",
        "AZ900-2.4.5",
        "AZ900-2.4.6",
        "AZ900-2.4.7",
        "AZ900-2.4.8",
        "AZ900-3.1.1",
        "AZ900-3.1.2",
        "AZ900-3.1.3",
        "AZ900-3.1.4",
        "AZ900-3.2.1",
        "AZ900-3.2.2",
        "AZ900-3.2.3",
        "AZ900-3.3.1",
        "AZ900-3.3.2",
        "AZ900-3.3.3",
        "AZ900-3.3.4",
        "AZ900-3.3.5",
        "AZ900-3.4.1",
        "AZ900-3.4.2",
        "AZ900-3.4.3"
      ],
      "published_on": null,
      "last_verified": "2026-10-15",
      "verification": "landing-page-content-reviewed",
      "authority": "2-official-learning",
      "editorial_notes": "Exam logistics and current preparation entry point.",
      "limitations": "Fees and scheduling depend on location; recheck before booking."
    },
    {
      "id": "learn-cloud",
      "name": "Learn path: cloud concepts",
      "url": "https://learn.microsoft.com/en-us/learn/paths/azure-fundamentals/",
      "author": "Microsoft",
      "type": "learning-path",
      "language": "en",
      "cost": "free",
      "domains": [
        "D1"
      ],
      "competencies": [
        "AZ900-1.1.1",
        "AZ900-1.1.2",
        "AZ900-1.1.3",
        "AZ900-1.1.4",
        "AZ900-1.1.5",
        "AZ900-1.1.6",
        "AZ900-1.1.7",
        "AZ900-1.2.1",
        "AZ900-1.2.2",
        "AZ900-1.2.3",
        "AZ900-1.2.4",
        "AZ900-1.3.1",
        "AZ900-1.3.2",
        "AZ900-1.3.3",
        "AZ900-1.3.4"
      ],
      "published_on": null,
      "last_verified": "2026-10-15",
      "verification": "landing-page-content-reviewed",
      "authority": "2-official-learning",
      "editorial_notes": "Preferred starting path; a coherent sequence with module assessments.",
      "limitations": "Training can include useful material beyond the exam outline."
    },
    {
      "id": "learn-architecture",
      "name": "Learn path: architecture and services",
      "url": "https://learn.microsoft.com/en-us/training/paths/azure-fundamentals-describe-azure-architecture-services/",
      "author": "Microsoft",
      "type": "learning-path",
      "language": "en",
      "cost": "free",
      "domains": [
        "D2"
      ],
      "competencies": [
        "AZ900-2.1.1",
        "AZ900-2.1.2",
        "AZ900-2.1.3",
        "AZ900-2.1.4",
        "AZ900-2.1.5",
        "AZ900-2.1.6",
        "AZ900-2.1.7",
        "AZ900-2.2.1",
        "AZ900-2.2.2",
        "AZ900-2.2.3",
        "AZ900-2.2.4",
        "AZ900-2.2.5",
        "AZ900-2.2.6",
        "AZ900-2.3.1",
        "AZ900-2.3.2",
        "AZ900-2.3.3",
        "AZ900-2.3.4",
        "AZ900-2.3.5",
        "AZ900-2.3.6",
        "AZ900-2.4.1",
        "AZ900-2.4.2",
        "AZ900-2.4.3",
        "AZ900-2.4.4",
        "AZ900-2.4.5",
        "AZ900-2.4.6",
        "AZ900-2.4.7",
        "AZ900-2.4.8"
      ],
      "published_on": null,
      "last_verified": "2026-10-15",
      "verification": "landing-page-content-reviewed",
      "authority": "2-official-learning",
      "editorial_notes": "Primary structured teaching source for architecture, compute, networking, storage and identity.",
      "limitations": "Exercises may require an Azure account and incur usage charges."
    },
    {
      "id": "learn-governance",
      "name": "Learn path: management and governance",
      "url": "https://learn.microsoft.com/en-us/training/paths/describe-azure-management-governance/",
      "author": "Microsoft",
      "type": "learning-path",
      "language": "en",
      "cost": "free",
      "domains": [
        "D3"
      ],
      "competencies": [
        "AZ900-3.1.1",
        "AZ900-3.1.2",
        "AZ900-3.1.3",
        "AZ900-3.1.4",
        "AZ900-3.2.1",
        "AZ900-3.2.2",
        "AZ900-3.2.3",
        "AZ900-3.3.1",
        "AZ900-3.3.2",
        "AZ900-3.3.3",
        "AZ900-3.3.4",
        "AZ900-3.3.5",
        "AZ900-3.4.1",
        "AZ900-3.4.2",
        "AZ900-3.4.3"
      ],
      "published_on": null,
      "last_verified": "2026-10-15",
      "verification": "landing-page-content-reviewed",
      "authority": "2-official-learning",
      "editorial_notes": "Primary structured teaching source for management, governance, cost and monitoring.",
      "limitations": "Check live product documentation before teaching feature or pricing details."
    },
    {
      "id": "azure-docs",
      "name": "Azure product documentation",
      "url": "https://learn.microsoft.com/en-us/azure/",
      "author": "Microsoft",
      "type": "documentation",
      "language": "en",
      "cost": "free",
      "domains": [
        "D1",
        "D2",
        "D3"
      ],
      "competencies": [],
      "published_on": null,
      "last_verified": "2026-10-15",
      "verification": "landing-page-content-reviewed",
      "authority": "2-official-learning",
      "editorial_notes": "Reference hub when a precise product claim needs verification; navigate to the relevant service page.",
      "limitations": "A hub is not a single complete course; much content exceeds AZ-900 depth."
    },
    {
      "id": "official-practice",
      "name": "Microsoft AZ-900 Practice Assessment",
      "url": "https://learn.microsoft.com/en-us/credentials/certifications/azure-fundamentals/practice/assessment?assessment-type=practice&assessmentId=23&practice-assessment-type=certification",
      "author": "Microsoft",
      "type": "practice-assessment",
      "language": "en",
      "cost": "free",
      "domains": [
        "D1",
        "D2",
        "D3"
      ],
      "competencies": [
        "AZ900-1.1.1",
        "AZ900-1.1.2",
        "AZ900-1.1.3",
        "AZ900-1.1.4",
        "AZ900-1.1.5",
        "AZ900-1.1.6",
        "AZ900-1.1.7",
        "AZ900-1.2.1",
        "AZ900-1.2.2",
        "AZ900-1.2.3",
        "AZ900-1.2.4",
        "AZ900-1.3.1",
        "AZ900-1.3.2",
        "AZ900-1.3.3",
        "AZ900-1.3.4",
        "AZ900-2.1.1",
        "AZ900-2.1.2",
        "AZ900-2.1.3",
        "AZ900-2.1.4",
        "AZ900-2.1.5",
        "AZ900-2.1.6",
        "AZ900-2.1.7",
        "AZ900-2.2.1",
        "AZ900-2.2.2",
        "AZ900-2.2.3",
        "AZ900-2.2.4",
        "AZ900-2.2.5",
        "AZ900-2.2.6",
        "AZ900-2.3.1",
        "AZ900-2.3.2",
        "AZ900-2.3.3",
        "AZ900-2.3.4",
        "AZ900-2.3.5",
        "AZ900-2.3.6",
        "AZ900-2.4.1",